id,id_usuario,id_curso,metodo_pagamento,descricao
3709,24248,1,pix,"Check arrive before. Hope yard last believe. Though direction land throw class point brother. According city large go pressure.
Government others involve traditional. Out inside plan into."
3710,21123,8,pix,"Difference dinner play image society central level.
Bank house officer into. Sport do decide show whom grow. Data middle word once summer try way."
3711,21097,40,cartao,Camera Mr adult standard my do. Smile research claim information notice them plan. Sure throughout stage property simple much police.
3712,22715,22,pix,Indeed another power risk perhaps out. Structure culture would watch. Fill team toward face body kind. Reach east maintain.
3713,19594,35,cartao,"Yes chair say toward traditional. Themselves identify their by impact spring reason. Entire help resource interview century white fire me.
Hold pressure happen democratic."
3714,899,26,pix,"Decade follow what add key will avoid. Man similar across local event of reality.
Yourself toward movement word."
3715,19353,3,boleto,"Purpose thought bad nothing. Live individual nothing hand trade.
White not half power kid. Rather face name. Report early voice expert."
3716,27123,25,pix,Quality significant become one true growth. Much world political level deep seat add. Miss like station movement contain technology.
3717,14407,13,boleto,Western ok weight would various. Sign together environmental.
3718,12857,10,boleto,"Kid three investment education.
Study realize billion. Central understand enter order anything back.
Lot look catch something. Enough performance experience."
3719,29761,5,cartao,Analysis degree travel against. Magazine not live service use. Career probably could us visit. With everyone agent tree must and relate.
3720,3672,5,boleto,During eight we little serve. Final firm meeting less score yard image.
3721,20774,35,cartao,"Support especially section material. Value worry security group into.
Away around information if. Our executive surface medical."
3722,25538,17,cartao,"Product order all address itself. Enter should girl course blue writer. She view enough machine.
Close year summer popular. Set drop board girl. After remain movie record agent father."
3723,23757,22,boleto,"Line scientist avoid director. Stage able project produce. Leg investment know include but teach challenge.
Step none mouth challenge next of people."
3724,9570,35,boleto,Including professional official shoulder parent go involve. Manager admit add admit truth. Range street discussion administration theory clearly reflect.
3725,224,35,boleto,"Enjoy sister community visit claim. Accept artist blood.
Region surface something article. Serve specific too wall.
Machine there form newspaper. South common table item check under."
3726,9164,10,pix,"Say response central down while. Or year worry.
Spring onto place people there.
Tend shoulder case. Really deep college doctor security second throughout. Arrive life town."
3727,3822,3,pix,Yard another prevent toward at. Any short threat myself political will. New participant month drug type cultural military.
3728,10146,34,pix,"Wall former hot bank nothing heart.
Coach time room develop community across. Year say cold ago direction miss include. Ability budget maybe benefit executive. Vote this eat behind and."
3729,3129,11,pix,"Everyone project note yes. Without note car. Media growth believe visit skill accept.
Agreement film image subject. Citizen stuff personal expert tax."
3730,27812,9,cartao,"Theory great friend option draw notice. Quickly administration course weight sign.
Sell final sense risk interesting red start. Write happy argue born."
3731,10625,35,cartao,"Network cold level season. Single good also chair.
Administration suddenly mean staff end spend town. Treatment situation mention fear. Stop peace present cultural many must decade."
3732,21597,27,boleto,Age husband seek true which letter. Everybody example school at commercial. Listen interview level again nor modern.
3733,26715,3,cartao,"Major job must artist about choice American. During sister seven suffer ask cause.
Likely today hospital pattern. Save which itself modern suddenly."
3734,21221,18,cartao,Region capital black drive stage financial. It because whatever worry plan.
3735,148,16,pix,"Ahead reflect sure describe without such speak deep. Read thousand record cell can party.
Sister film lose sing. Country them help stop whole off. Community course black.
Environmental school attack."
3736,26569,17,cartao,"Say long lay involve happy quality. Effort near black thank same important environment along.
From save Congress pass. Support consumer keep choice."
3737,18804,4,cartao,"Staff manager arrive tough professional live. On everybody subject form power there kitchen.
Attorney strategy range do difficult way should meeting."
3738,18057,35,pix,Claim ever represent. Final focus whether television less everyone most behind. Full simply daughter gas together local as provide.
3739,29380,12,boleto,"Red anything little score maybe without impact. Sure open five gas increase property. Anyone compare sport eight commercial.
We line part this brother out physical. Especially wide few."
3740,1900,7,pix,Late brother avoid government. Return authority total account cut. Better body front best paper material final writer.
3741,8521,13,boleto,"Receive fire of teach. Anyone whose several save respond pressure around. Ball couple cold wrong car.
Bag alone not. Story case dark such wife member fund."
3742,3727,30,boleto,"Opportunity since hair memory peace. Center food policy on rich window election. Mr indicate size sign.
With city century father economy. News edge cost reduce yourself individual stuff."
3743,4588,27,cartao,"Last the hope year join represent design. Fact act car lot building court government.
My indeed interest expect force should development. Discover mention kid deep."
3744,16931,9,cartao,"Whether rich fast across speech general whole. Strategy page improve everybody every.
Kind defense way vote measure risk. Buy popular information ability man agent loss. Still rise guess value."
3745,9661,5,pix,Note begin dog military father inside. Follow piece eight picture meet relate.
3746,24996,20,boleto,"That budget onto her. Really miss western form. Boy chair performance feeling peace high. Might area finally finish.
Hot there clear too scene study. Become life son look among."
3747,5570,37,pix,Various bill data kid. Its contain address deal family someone smile. Social which two store into.
3748,24570,21,boleto,"Agreement development save floor. Either official voice major mission.
Do establish four eight. Nothing least them education billion computer series spring. Support north will dinner story race."
3749,10714,34,boleto,Network kind view during camera find still. Decade seat who those impact decide strategy. Gas card card lay point create however.
3750,26256,5,cartao,"White someone continue machine. Upon hot notice also health four.
Table man full girl forget. Red wonder other laugh only west sister realize. Audience various small star institution medical."
3751,29784,4,cartao,Policy finish before style require official actually. Single as too expect would think stand. Far knowledge blue both as can form.
3752,4942,36,pix,"Listen tree career. Place you draw effect. Field form crime guy write low.
Prepare notice campaign seat almost several. Us main student training character."
3753,10251,23,cartao,"Most professional book will. Term political discussion. Know case necessary cover employee choose production. Necessary action art leader heavy whether.
Very everything sort like have opportunity."
3754,10837,37,boleto,"Which enjoy price. Agent himself political situation again either third. Hand lot after apply human between business.
Trouble eight hope political recently politics. Pass market expect modern main."
3755,17279,28,cartao,"Realize design special college environment hold. Surface expect sell receive sort discuss.
Large record region truth structure perhaps."
3756,12399,6,boleto,Seven continue already newspaper. Role during half decide window happy space.
3757,4277,3,boleto,"Physical only nothing leave. White full road huge education cut.
Because model seem. Value eat order piece many box south. Tv and very his kid each make."
3758,6738,12,cartao,Weight pass put well. Exactly someone pattern table staff staff speech. Sense treat these check.
3759,7974,20,boleto,Fill answer policy modern. Item new mother rather energy specific around. Whether site house word couple nature man.
3760,9043,24,pix,"While throw civil order apply edge another. Behind need recognize smile. Task attorney best determine certainly.
Seven kind low everyone. Four our there its.
Throw smile left hard."
3761,25202,1,cartao,"Common piece race. Individual fall program us early. Degree might PM.
Respond fact chance structure box five. Game surface leader operation.
Up sing hour focus by. Measure produce training laugh."
3762,14399,32,pix,"Style officer set weight hope. Social decade own would power relationship.
Role third whose firm make town bring get. Bar return true all step. It here card relationship."
3763,13710,40,pix,"Month six run war character. Star expect win decade. Kitchen any list.
Result take first. Environmental bag term teach wife white run. They must check factor help drop never couple."
3764,7483,2,pix,Receive raise rule wide around range. Mean already police after project participant north. Camera growth run conference lose. End daughter daughter step.
3765,1529,34,cartao,"Condition it from garden security continue. Back with really set when trouble light population. Happy loss represent plant trouble himself same.
Seven sport without. Determine yet protect your paper."
3766,17193,1,boleto,"Risk computer baby bad. Ground in someone pattern citizen positive loss. Indicate buy response cost skin.
People no cultural of. Successful chair language development thank news difficult."
3767,12182,9,pix,"Soon key shake situation least someone. It late north month end half.
Market stay population give collection. Reveal cover attorney agreement debate value."
3768,27304,32,cartao,"Magazine wind clear people perform her. Make person do civil. Friend lot child art.
Always energy government must approach. Protect position appear join ok bed technology success. Head Mr bit."
3769,898,25,boleto,"Food scene level will point. Although become vote. Sell child outside call one democratic enjoy.
Station go between long student car that. Term we seem."
3770,21,15,boleto,"Show east in speak three exactly voice turn. Respond wish bill maintain western.
Analysis rather fast. Rule bag check."
3771,13995,14,cartao,"Lose heavy two police vote case. College real rest technology modern get every.
Role hair difficult collection woman available investment. Leave late finally anyone could."
3772,7036,6,boleto,Anyone deal easy seek respond court. Owner specific send list magazine write modern. Maybe house thousand green enough law. When box win second.
3773,18857,38,cartao,Hour have music. Its chair well table finally. Whom finish perform member project nature. Law organization board meeting guy poor.
3774,6050,14,cartao,"Last environment story despite four research. Total series protect board seem young.
Half try politics theory military her interview exist. Discussion whom else."
3775,29797,30,pix,"More win figure might south.
Interest research far car order. Cup leader admit under law pattern fly several. Dream environmental Mr line."
3776,3978,18,pix,"Strong early artist traditional area story or. Husband sort reason. Subject look wish save owner quality add.
Station agreement involve good boy. Population field her from gas level boy."
3777,27733,8,boleto,Glass daughter sound left miss line treatment. Nearly population assume seek rate development into Mr. Government exist affect along friend.
3778,28738,34,pix,"Family present quite relate image. Contain today whatever stop activity particularly. Whom should shake.
I fear room world project southern. Doctor name four."
3779,18548,17,pix,"Forward project it once product. First baby develop. Him former recent game serve character check. Do teacher who less plant party style future.
Song bed citizen play over pass."
3780,21416,1,cartao,"Form several behavior east many world son. Meet care enough so key.
East believe box feel term include. Write door paper level type significant high."
3781,8927,11,cartao,"Hope fast good wall service Mr check reach. Common he trial special kitchen. Image local above story. Summer director sister project learn happen plant.
Lead moment outside remember."
3782,13448,39,pix,Company window blue three believe. Direction open learn join bed more. Beautiful issue other someone American training.
3783,19754,14,pix,"Court next note read. Night treat know believe tax large. Indicate political end apply.
Boy future we manage shoulder. Attorney pull quite.
Food player improve. We Mr manager simply class test."
3784,3771,6,pix,People short travel gas three sport research. Sport issue indicate. Statement energy forward.
3785,25000,39,cartao,"Thank prepare crime end worker glass. The occur tax more style allow.
Form speak their. Television general exactly forget. Collection western debate religious man often."
3786,21057,35,cartao,"Sell peace stuff strategy which decision. Special goal single open century.
Course might line partner dog.
Magazine daughter show else fight. Into attack either movie open ok."
3787,25582,21,pix,Wish simple forward hospital measure church. Dog less close possible. Subject need contain budget.
3788,22663,37,boleto,"Address go resource point. Including out month southern newspaper owner.
Bad style animal. Parent head movie risk."
3789,9014,31,cartao,Physical inside Mrs work. Them rise rise writer. I understand perform support street mother knowledge purpose.
3790,23081,9,boleto,"Manage account cut institution sea evening Congress. Most before fill tax cause reality stuff.
Successful agent space quite. Kind its person my radio early.
Natural situation painting phone best guy."
3791,1217,33,boleto,Theory effort home onto. Line system response position senior feel report agency. Hot personal itself true be. Hot election within president.
3792,13371,20,boleto,However him adult me development itself. Suffer magazine simple serve author.
3793,1015,36,pix,Generation on produce team strategy usually. Particularly agree whose position. Century woman success smile half shoulder give.
3794,14586,21,cartao,"Future face win manage season important. Player know middle into thank where station night.
Cultural none into their television. Gas arrive gun short level.
Statement senior eight lay arm my."
3795,22986,19,boleto,"The include food all worry kid. Card big rule develop task.
Why hot born after success week whatever. House how during require.
Left hotel case option either. Affect second land call."
3796,19032,37,cartao,Staff trial quickly hospital agent view garden. Agent vote cause during whole drop itself. Without simple wide building land light find.
3797,25073,9,boleto,"Gas budget opportunity sister red everyone. Pm throw last good a. Religious wind away also push feel.
Ask plan under know several audience."
3798,21253,28,pix,Set loss response also audience. Other resource daughter upon authority threat. Guy much election song center hold probably number. Participant rock truth specific husband.
3799,9165,24,boleto,Across mission hour seek probably alone which. Approach strategy morning inside individual suddenly. Though forward production hospital garden. Thousand control single road.
3800,24501,17,pix,Amount environmental go color heavy. Present one someone than assume interest animal. From seven community.
3801,1586,26,boleto,"Majority foreign onto training lot special look. Read stop sure seat. Paper together south back probably.
Tax citizen him fly for whose age. Hair him expect through."
3802,10724,26,boleto,Thank significant common four cell case represent present. Serious pressure often establish. Face pattern space stuff garden peace lead responsibility.
3803,12551,33,pix,"Mother enjoy admit street he help. Food age per president again.
Reach show tend. Apply shake nothing finish thought chair. Civil more part small sister."
3804,20260,20,boleto,"Word laugh group.
Ok sell street management success think any agent. Down turn one involve.
Health maintain score final believe force. Clearly treat more show firm office this."
3805,978,12,boleto,Listen despite near high situation author and. Democratic trouble four claim nature safe ago. News us visit believe yes total whatever.
3806,205,19,pix,Available scientist heart. West feeling no song what car material whatever. Project bring machine activity us away happy.
3807,5361,8,boleto,"Head number recognize west. Energy middle health.
Mr it set attack yeah stock close. Difference subject spend trade owner figure."
3808,22675,40,boleto,"Daughter agree television defense unit it. Suffer this strategy according real student to animal.
Side project wish likely production among reality. Until type fill at."
3809,29417,20,pix,"Industry fine truth meeting red ago tonight. Soon fact take information book million especially.
Republican food goal cost wait. Throughout drug thought best he."
3810,7752,11,cartao,Product while security cost environmental. Market peace staff edge. Management else artist fact story no two continue.
3811,20820,13,cartao,Often seven Mrs art. Happen evidence door follow realize student trip. Sea reflect ahead charge leave themselves.
3812,19501,21,cartao,Son president case like world commercial. Difficult ground pick five analysis must town. Star discussion woman receive. Full front get action.
3813,2619,19,pix,"Black property movie between road.
Necessary design think career most. My poor enter appear."
3814,8541,12,boleto,"Get measure lawyer side baby standard. Staff debate social method show computer.
Onto operation summer receive rich what. Draw ahead act door shoulder view."
3815,25963,31,boleto,Fill participant end factor sit. Health key man machine history size manager. Tonight teach bed behind indeed deep win talk.
3816,15995,9,boleto,"Human control argue mission result. Piece trial rest series protect we none.
Human life become pass strategy man senior. Rather career movie apply well me discussion value."
3817,28788,27,boleto,"Adult final century.
Reduce main wind development. Court range democratic. Decide course might teacher sign sing."
3818,23149,11,boleto,"Effect explain like fight happy. Sit in which us despite. Budget head represent treat maybe.
Vote without suggest. Name three order return. End history center population."
3819,2870,38,pix,Recognize amount individual management. Natural pressure increase person. Risk my agency alone point. Young around glass fund customer impact.
3820,21899,2,boleto,"Least today building economy. Unit fund claim perform kitchen society.
Help media become per score once bed."
3821,19062,17,cartao,Site evening include parent thus agent. Apply program civil member. But admit professor base look.
3822,16426,5,pix,"Last provide plan class responsibility argue. Through benefit let. Detail seven race.
Music identify book. Pick example economy second."
3823,23432,16,cartao,Analysis human man. Hospital hard blue garden protect stage. Similar wait study herself within too operation with.
3824,28601,30,pix,"Parent population population she unit late college painting. Follow recent party myself indicate wait.
Draw class other as unit feeling. Since event reach contain around wind detail."
3825,13176,34,pix,Personal leave television not everybody exactly tonight. Kind threat itself return interesting imagine.
3826,21411,19,pix,"Perhaps raise world agree financial full. Follow happen hold front minute southern.
Strategy positive president necessary. Help home same education."
3827,26120,10,pix,"Idea herself short. Religious lot get on along.
On almost contain. Occur success rise star."
3828,9844,40,cartao,Partner collection dog car them include food. Education young financial source practice election. Again see issue despite.
3829,3216,37,cartao,"Mouth eye ball become. Hotel some later cut prevent sit never interview. Goal director resource me.
Body their old instead follow bed out authority. Who down sport daughter various."
3830,22311,1,pix,Great ok instead pay girl board growth. Their cut leg bring speech mean. Mind memory whose we.
3831,27441,29,pix,Benefit article court whose what buy. Social close should sometimes. Modern new study success today fire. Girl after of government.
3832,26530,1,pix,"Three mean real indicate establish. Top need painting live rise lawyer.
Scientist win environmental both prevent answer front. Food edge above section hot foreign lot."
3833,1159,8,pix,"Billion central create.
Professor forget television attention same. No relate kid side across kid ever."
3834,11723,4,cartao,Control my behind close or. Relate win from defense almost various decision. Stuff do impact generation security you.
3835,6078,36,boleto,"Garden Mrs girl activity season message fire. Ball fact white.
Raise it analysis knowledge water. Improve gun least.
Resource statement tree executive far that. Wonder huge side start wonder."
3836,18782,7,boleto,Board decide responsibility. Relate family fall church. Candidate magazine until risk its how fly believe.
3837,4693,25,boleto,Garden stand even business health moment pull. Subject however red significant number at.
3838,11707,7,boleto,Thus television common just country management society. Any again many term low. Glass somebody outside none raise. Next structure miss situation paper able.
3839,12154,4,cartao,"Despite question cost describe believe arrive central. Third administration against cup between.
Specific open pay teach. Recent paper whether experience that at."
3840,17426,16,pix,"Happen peace either rate describe talk only. Check let affect none help. Enjoy decade book letter how language candidate.
Mention threat environment that attack. Simple to hear off can."
3841,9240,39,boleto,Security skill government less where skill system. Base ready themselves home.
3842,23056,25,boleto,"Arrive a attack say floor drug. Source indeed service down sea fund wonder. Yeah accept even within if nice.
Include good government. Writer decision kitchen land five relationship wear."
3843,25131,13,pix,"Final why technology general direction.
Particular order ten site form finally couple quite. Hold them hair interest."
3844,23662,6,pix,Real against and all board. Trade other write be. Old audience easy sense record professional force. Amount cover language institution image best government tree.
3845,16137,4,boleto,"Road fight suggest. Under friend that instead anyone. Hear subject weight soon cup.
But various morning level matter. Bar same leg end mean remember four."
3846,9997,32,pix,Financial front look several action inside lead arrive. Never daughter may interest voice job laugh. Decade particular learn region long.
3847,13432,33,cartao,"Beyond whose happy quite their prepare test right. Public real administration clear garden game.
Somebody Republican teacher threat color news. Sell western environment like measure husband law."
3848,21943,35,boleto,Want few play rule class look. Probably kind hour serious such your. Administration total public air usually provide send.
3849,21405,3,pix,Hour ability environment human family upon hour democratic. Hear response head face water appear carry. Meet administration drug PM doctor. Follow inside we.
3850,6828,28,pix,"Different yes film fine want. Easy he east style use nothing sort.
Others that during discover audience. Head owner interesting play message guy heavy politics. Energy everybody attorney any assume."
3851,14886,13,boleto,"Art general measure spend six should number national. After floor couple begin buy boy both. Wonder lawyer far pretty civil.
Size bar home with before group blue me."
3852,26958,12,pix,"Record history hot your sign level discover. Buy travel task local wear treat more. Government walk economic too story card.
Energy father prove simple detail dinner agreement. Skill measure over."
3853,16055,9,pix,"Fall challenge box bag beautiful world population. Green spring use wind him senior fight. Way process street response improve become.
Life catch surface audience."
3854,12027,23,cartao,"Hard buy easy party build. Partner evidence less peace development common clearly.
Realize true want worker life reality. Wait foreign perhaps. Small player what industry sing."
3855,27171,29,cartao,Compare book sport story force. Kid officer seat series allow. There wall deal pressure official.
3856,20780,25,pix,Treatment say spring beyond cause. More writer fish store. Actually hold term attorney baby attorney.
3857,27842,22,cartao,"Me economy arrive company cup.
Than course teacher child car day actually. Mention young near part sound here. Several rest paper former western Mr cultural although."
3858,4529,23,boleto,"Certain long themselves against indicate by other. Bag season even president.
Safe second establish. Behind tax environment base modern present worry. Much economic here relate."
3859,28029,40,cartao,"Decade likely opportunity direction fire apply detail phone. Both material record art avoid. Dog traditional strong of born there.
You political yet. Me debate house."
3860,7622,10,boleto,Through range century financial specific. Remember item care price start author on. About lot second year.
3861,23675,9,cartao,Present truth through work address whatever walk fill. Religious simply behind language. Employee couple language rule.
3862,12746,19,boleto,Turn along east likely audience poor. Production generation law. Buy fight why cold not call protect.
