id,id_usuario,id_curso,metodo_pagamento,descricao
1249,12136,39,boleto,"Care inside big rise back listen.
Student ground view north. Act run quality music result expert. Charge pressure more staff sense sister position."
1250,25319,36,cartao,"Particular person story. Author five five trouble. Process type world knowledge commercial.
Let ball kid send finish interview pick. Bag morning great fill sure."
1251,738,26,cartao,Almost fact cup method all force environment wonder. Draw kitchen teacher either it speak. Those actually first employee.
1252,12754,37,pix,"Send majority move ten box. Same but push role.
Stand sense one sometimes region age. Whatever science program. Cut explain education account."
1253,10588,32,pix,Able station hit rise hold. Table at father kitchen pay. Whether yourself nor east she.
1254,28126,19,pix,"Among two phone when expect. Gas own must less own stock hair.
Form instead short edge movement agreement. View yard probably society."
1255,20455,29,cartao,Money business forget accept about surface mission miss. Rest begin owner fish many detail similar. Feel including risk identify.
1256,25553,9,cartao,Too too message service mission dinner key so. Personal include growth strategy ever.
1257,19588,20,pix,"Sit action specific human fill. Fire writer perform nature piece.
Eight ever exist shoulder teacher. Small common help model. Question including be speak budget increase."
1258,22681,23,pix,"College civil technology. Popular fine imagine despite medical perhaps.
Summer bar behind son box whom."
1259,9903,23,pix,"Prepare he single someone especially worker step picture. Public game west degree health.
Over tough scene. Any particular mind else anything into I."
1260,14160,20,cartao,Surface stay rule owner training meet after. Produce ten character type report science including. Trade cover yard enough TV deal. Church personal pretty.
1261,21303,14,boleto,Behind low after name. They second with institution. Organization who yeah work own. Majority air shoulder into.
1262,28562,3,cartao,"Grow there around bit specific. Seven prevent necessary rich.
One he foreign until lawyer. Strong probably economy ten bar. Week world anyone common magazine sort have four."
1263,19439,2,boleto,Find about power soldier black quality. Nearly sort already necessary hospital policy. Build might just green tree media institution.
1264,26875,32,cartao,Among scientist none time less because. Through chance try source affect cell individual. Sometimes hotel sort chair.
1265,1669,12,cartao,"Republican education only toward medical. Response environmental camera wish. Born indeed around medical condition reality glass.
Interest choice run. In recent special her single draw open."
1266,28814,3,cartao,"Change poor life act book make hot. Billion next writer attorney learn who. Company indicate commercial here bit.
Instead indeed mention.
Debate cost toward case."
1267,757,1,cartao,Old itself there front on child consumer. Account bad west right. Message brother trouble training factor life.
1268,12345,7,boleto,"If you article professor. Plan investment own mother analysis. Purpose among ready operation less indicate quality industry.
Bag help like anyone. Mean bring space hope discussion."
1269,22171,31,pix,Write store store church to. Night true just on certainly since state resource. Kid summer better.
1270,5053,24,cartao,"Season performance article Mr day more. Would half foot. Program federal question school daughter.
House arrive peace military budget. Throw affect check career stock doctor."
1271,19780,23,cartao,"Modern technology begin. Factor street appear teacher.
Turn my young use. Attention senior worry beat ago. Ground shoulder beyond term class evening. Network speak laugh first."
1272,7269,40,cartao,"Yes term policy hand.
Industry apply decision return. They other forward movement inside. Line federal choice face go.
Street successful put pattern. Set pass anyone."
1273,11797,36,boleto,"Foreign seek open yes financial key. Be painting whole everything.
Family clear keep ever property never protect. Give open measure approach court movie very."
1274,2953,15,boleto,"Look people her bank production. Collection raise section end. Worry glass knowledge middle.
Wonder born budget yourself."
1275,21291,21,cartao,"Or direction sound. Plan whatever lead home. Response their whatever take.
Cause rest glass attack yet possible. Sit be various page key all expert.
American ground expect full. Mouth throw bill you."
1276,516,14,cartao,"Late international place debate thousand. Fall open off Republican himself quality process. Mother color executive always write president.
Turn chair sound weight myself."
1277,2493,6,boleto,"Attorney friend special film piece benefit. Past those network site change speak.
Baby read feel see. Good tree arm affect middle item natural."
1278,2315,33,cartao,"Wife number choose little. Major say avoid anyone whose front need.
Build character little much tell have same. Get nor either road. Lawyer artist girl gas."
1279,10403,8,boleto,"Whatever build its full would. Run another we.
Cup throw body themselves. Near region plan play."
1280,19328,17,cartao,"Exactly idea interview stuff. Smile out week conference challenge our write class.
Entire else special purpose. Bar say white international science product."
1281,26468,24,pix,"Stuff interest play article far fill whatever. Carry member now feel.
Rest exist direction whose less animal southern consider. Leave better sure will sell. Degree system rather know allow."
1282,25116,37,boleto,"Notice finish act probably. She investment power listen. Actually law life knowledge care deep no.
Tv agent option. Offer president face once option paper agent. Green case two tax."
1283,15903,8,boleto,Own race be central clearly wrong. Suffer toward friend ever human before. Radio cut small teacher party hard door.
1284,12250,32,pix,"Section break risk like part. Card hair property world process state reason. Sea popular fish experience figure business.
Author assume born under factor clearly do. Fight time sense close."
1285,28607,14,cartao,Able call pattern outside pay decade before. Unit miss garden admit at sure two.
1286,4347,12,cartao,Everything Congress source sign benefit listen growth other. Pm recent federal church heart win spend.
1287,2230,24,boleto,"Against world community him a scene concern ever. Bar director she discuss let control final.
Attention perform huge. Activity challenge major. Financial study your student movie size walk."
1288,353,9,cartao,"Window family matter police control. Reduce soon particularly value order. Race project all.
View likely image. Body soon receive tell health."
1289,17011,22,pix,Level near leader into shoulder goal her. Everything again happy cover. Nearly whose sing condition force. Executive ten position green computer not apply mouth.
1290,16615,11,pix,Activity west clearly information little discuss how. Enough simply budget director trip.
1291,12433,39,cartao,"Reveal watch responsibility baby music water black. Sometimes where society.
Thing his pass fear late. Series family after minute ask mind again."
1292,1578,30,boleto,"Put drug movie candidate choice support. Mr civil list issue safe second movie.
Customer major several indeed. Several both assume final forward win. Learn more air marriage me official dark similar."
1293,27114,1,pix,Western day kid star capital several agree. Stay seem case right leave price represent cold. We serve town control.
1294,14855,35,pix,"Finish thank red across cup soon.
Sure produce room purpose more. Myself message close. Commercial able Republican need."
1295,10005,1,pix,"Mr interview teach. Possible hope make someone into thousand.
Economy office although member voice member Republican."
1296,6772,20,pix,Throw hour avoid nearly become. Responsibility few worker partner visit economy cost. That he standard court whatever.
1297,15629,23,cartao,"Account education serve loss opportunity reveal figure. Alone civil number sign. Court open reveal.
Media agency try center budget. Detail claim nice buy."
1298,28564,32,cartao,Beyond view sort entire let car his. Learn compare long team later loss. Put cold sell market industry there seat. Consider national police open check.
1299,6244,4,boleto,"Force describe purpose subject science. Capital heavy behavior still lose collection.
Gun father although. Task able happy very why."
1300,20847,26,pix,"One name hair tell build stage view. Down compare place organization dark. Old program phone.
Age pretty customer early travel. Computer role poor near now."
1301,27424,39,cartao,Today beautiful agency toward student finally successful.
1302,7678,12,pix,Floor product boy one who dinner. Set find central just author where near. Respond go foreign cell time deal.
1303,1256,25,cartao,Other pressure into trip with nothing. Question according same whatever civil. Over include usually building threat answer.
1304,14153,25,cartao,Sign under north too concern. Each up add save data anyone. Own price until always week national war.
1305,22831,18,cartao,"Material good hair indicate. Claim run past second back.
Successful most second song school person. View including look rest hand special sure."
1306,2129,3,boleto,"Heart walk better glass church. Else itself sign free method.
Though lose process. Time rich several pick wait."
1307,23982,5,cartao,"Possible not general soldier president film after. None account start example free wife.
Author against available. Fall high individual situation official these allow."
1308,18196,20,pix,"Oil yet box some accept best size stop. Lose cost matter it visit.
Worry general investment they. Low act color party community dark despite song."
1309,22319,14,pix,"Between individual claim hope save return half. Market strategy kid not. Name trouble bag reality return.
Sea if argue happy. Pull able artist room change current."
1310,15127,3,cartao,"Contain hair collection listen action. Send sea rate reflect he car.
Discussion community chance another control truth position. Site house may talk nature."
1311,22843,40,pix,"Seek home course order relate hit. Effort play information hit second TV him.
For manager save son economy manager.
Another they story per individual country industry. Chance him lose your activity."
1312,17441,36,cartao,"Chair talk technology. Skin carry make raise attention brother.
Thus parent teacher recently. Church magazine shoulder identify use. Police other structure trouble Democrat."
1313,2473,9,cartao,Green production must heavy also while. Example know who coach certainly baby care. College activity certainly human majority note.
1314,897,6,boleto,"Finally floor according TV say behavior. Nature organization material stand answer foreign.
Appear two activity science under. Save artist most far history."
1315,3909,40,pix,"Spring article nature image general expect page matter. Yeah likely speak meeting bag key ability.
Other fund can trip allow. Control point majority particular indicate democratic."
1316,27708,37,pix,"What south yourself each. Food floor Democrat vote open try.
Here this order everything laugh theory."
1317,31,4,boleto,Far sit black year. After sing how range daughter tell church.
1318,2815,27,boleto,"Lay animal company we. Town paper teacher those medical without stop. Guy particularly through success type case.
Person candidate our recently church whom. Program allow too air home."
1319,2255,29,cartao,"Report official away two course peace. Certainly simple election decision.
Goal suggest official customer decision sort common. Republican smile heart. Budget reveal two dream forget."
1320,15119,30,cartao,Tax such reason partner television teach least. Six when already artist voice for. Buy west and upon choice.
1321,18515,16,boleto,Reveal argue happy quite notice cost. About play wrong traditional season available simple rise. Land specific ability politics per especially whatever performance.
1322,21708,5,cartao,"North realize arrive painting up agreement cell. Final cup stuff across fund other detail.
Sell woman beat. Move fish wonder decade benefit cause billion relate."
1323,4898,26,cartao,Memory hard state second western agreement sit. Concern without among. This stuff product sure.
1324,12397,24,cartao,"Government drug population others relate foot fall nor. News remember fire.
Buy knowledge draw including site while table. Clear describe seven weight professional concern method firm."
1325,26130,7,boleto,"Drop move ten news huge go. Girl leave across white beyond well yes.
Number decision thus involve worry. Commercial miss body reveal discussion none happen.
Network place outside nice."
1326,25800,10,pix,Could account not understand use marriage reflect. Indeed purpose plant party possible. Program various teach wall organization chance. News head control mean present prepare.
1327,25986,16,boleto,"Number energy leave lose usually happy. Quality improve imagine customer experience.
Book beyond quickly car hour professor civil. Water page fly explain time country no."
1328,2490,28,boleto,Number kind red enough air effect group. Each manager likely position society. Majority president bed manager.
1329,14463,9,boleto,One real discover brother many area interview term. Suddenly as this realize mother movie executive if. Boy like have left.
1330,15967,38,boleto,Wall science particular provide wall receive four. Perform strong call long. Force night assume garden southern argue save account.
1331,8662,29,boleto,"Its entire its church painting. Thing may clear yeah occur music enter.
Second key network TV evidence religious. Three use help hope seem."
1332,12375,8,boleto,"Keep agree everyone mean no.
Kind control return me act recent player. Clearly practice team fish without.
Six civil political line matter bring police. Lose product effort later group town back she."
1333,26539,34,pix,Foreign maintain trial structure do red traditional. Indeed reduce benefit short mouth table. Around manager score feeling answer every participant. Name when light must.
1334,21086,28,boleto,Determine meet weight others try. Suddenly produce range piece social recognize perform fly.
1335,11337,1,cartao,"Example design other agree.
Science sort work movement fall skill. Home scientist join including none stock land."
1336,12985,40,cartao,"Hospital voice animal town goal six. Pick happy evidence set. Cultural surface suggest.
Upon relationship raise growth black thought. Free look station history which draw."
1337,18468,7,cartao,Challenge upon account safe. Make newspaper situation wind design history. Also reduce similar school stuff garden baby.
1338,16805,5,pix,Student work camera project its near. We plant garden half same. Many worry throughout himself inside.
1339,28761,19,cartao,Model yard ready ever reason either. Executive money every system pretty election can.
1340,3548,26,boleto,Go page film despite order important personal. Have but test poor car country. Agree lawyer college look inside couple.
1341,24954,26,pix,"Guess specific best country thank along. Quality physical future simple arrive. Night follow during cell politics.
Simple and image figure. Member rich woman office central not final."
1342,24507,5,boleto,"Without student put. Too to play now project morning.
Enjoy almost heart. White none far morning term miss government.
Physical model food finally wear. Machine top treat might."
1343,15523,30,cartao,"Those wall bad win. Social scene across.
Class and conference economic. Often support clearly seven sometimes enjoy summer prepare."
1344,23353,22,cartao,Hope seven most doctor mother herself detail. Huge ask close pass feel defense. Teach during growth partner law sort there list.
1345,1601,30,cartao,"Buy window perhaps their.
Team when early home option building. Fact design task account."
1346,10914,12,boleto,"But something clear on style writer personal. Kind clearly wind may think.
Interest agent while many. Drug argue six conference."
1347,15221,22,pix,"Home institution add part early whether trade. Responsibility worker read loss store level story.
Side civil will either role. Perhaps woman deep.
Born red college."
1348,21043,31,pix,"Strong home four cost. Level wall person.
Least value project TV bank sea feel. Accept risk serve red cell impact.
Serve why security. Property foreign reflect.
North analysis itself bank star."
1349,5718,6,cartao,"Gas when deep cover ten run final once. Head yourself employee throughout mouth opportunity under.
Knowledge into star final choice. Better science paper whether popular."
1350,3642,1,boleto,"Mention collection attack add television. Director local never probably major Congress. Test you large recently.
Firm answer father someone exactly. Economic many serve doctor. Run of tell support."
1351,11772,26,cartao,"Soon fight sort like study two act. Difficult into physical culture for. These machine watch us.
Stand rock social. Region why exist age number key. Site account list Mrs eye."
1352,20612,10,cartao,"Firm method foreign. Seek mother physical music they customer down act.
Attention recently nearly lead. Imagine after economic week happen avoid."
1353,24941,15,cartao,"Maintain laugh purpose day section story identify. Fall serious apply hit total. Sort yes region degree.
Summer pay community dream product. Office involve house just."
1354,22144,24,boleto,"Experience organization heavy. Success drug least deep unit.
Leave individual traditional week sound. Identify do service couple. Century buy movement house structure similar."
1355,9252,21,boleto,Vote site foreign letter movement heart. Door score raise personal ask important employee.
1356,28238,40,boleto,"Police offer use me pass we pretty. Put what now particular different.
Effort whole quite color. Discuss certain east true. Budget west cost determine he true popular. Price star might anything."
1357,11883,35,cartao,Decade view statement two become marriage relate. But assume whether push.
1358,22683,40,cartao,"Use himself politics week according that.
Street partner in top fine front piece. Decide security offer.
Third it future door. Still way art support page contain. Style culture art."
1359,8822,5,pix,Season coach court star third. Including drop official whatever care value debate. Occur market night program over every white late.
1360,7029,25,cartao,Continue expert chair soon ask message interesting. Eye eat address blue. Firm attorney operation seat soldier only hand.
1361,1647,16,pix,Successful certain difficult. Another main group TV. Pressure try city fine themselves value. Relationship teach charge property speech compare.
1362,7108,18,pix,"Song example tell real. Brother training water set thousand election federal.
Rate stay partner true east condition theory fly."
1363,9775,36,cartao,"Identify care southern. Raise despite enter.
Prove especially which management service because. Certainly different most machine TV rather. Each talk able financial resource election."
1364,29074,10,pix,"Tonight my clearly chance make attention.
Ask leg father here event necessary.
Side report serve. Eat miss become here international. Nor great perform door."
1365,27429,11,boleto,"After assume perform identify beautiful happy. Statement political no indeed poor ok series. Police suggest American way find entire.
According program agreement. Do decade memory sister."
1366,13976,6,pix,"Chair visit cold be result end few various. Popular fire stand benefit. Marriage campaign impact listen stay fire.
Song according expect item. West itself administration attorney improve."
1367,20474,34,boleto,"Study ahead page even will walk. Will tough long. Safe good case level save adult.
Husband attorney order might new though anyone. Young product month call. Pattern nice young as a."
1368,19202,15,boleto,"Program next pretty. Push push society it team. Sit image manage operation consumer.
Deep find color lawyer nor all school. Cover fight idea collection especially former."
1369,14398,38,boleto,"Against pick before allow meeting peace. Establish both figure last.
During east discover level. Brother participant race nothing."
1370,8165,1,cartao,"Force around letter most offer who. Still figure doctor effort.
Stuff east month reveal specific. Reveal assume discover be I also although."
1371,26418,1,pix,"Candidate yes can gas society consumer describe. Employee instead cut finally action by notice.
Network year yeah television green modern guy. Boy also piece."
1372,8762,19,cartao,"Different project hard build.
Realize feeling structure full light whose local. Practice raise style east. Line call life he spend our decade."
1373,13673,32,pix,Forward quite building subject page second example. Series red without agree positive attorney memory child. War both next material.
1374,20806,19,boleto,"Item issue go specific enjoy look play cut. Own nor raise second. Avoid big difficult health example.
Side ago example area. Person parent art may place apply."
1375,20874,35,cartao,Direction continue only every. Study attack seven enter animal sound increase mind. Structure voice would number decision wind.
1376,10313,10,pix,"Attack property skill bring significant note scene. Condition turn hair best light process six.
Think dark want skin me my. For already raise least car available."
1377,21580,11,boleto,Itself he student boy economy. Kind despite large sense through. Line senior lose reason.
1378,9110,39,boleto,"Expert that rate.
Today foreign blue hit attorney out reduce. Know offer break. Least board mind significant might appear include do."
1379,17619,27,boleto,"Could deal recognize within information sing. Painting side radio leave church water shoulder night.
Since around bag room. History support fire some heart. His perform smile rather practice arrive."
1380,6269,22,boleto,"Civil key computer tell word. Serve weight give really.
On property conference way personal news training. New hand why choice art.
Everyone house far control general. She sure yes leave arm sign."
1381,28278,25,pix,Society believe room forward senior. Show chance story decade bank white. Leave information past week.
1382,806,35,boleto,"Dog model risk detail throughout. Player land them peace ask growth improve.
Industry cell strong lot bring bad. Thus environment establish about set scientist. End all program follow."
1383,11861,14,cartao,"Ability find age who.
Themselves phone father boy. Successful military easy pay include over.
Industry reduce main how option. Six see then it population."
1384,24341,23,pix,Part amount left explain so break. Add authority kind culture course. Health manage three fine. Per raise although their.
1385,19562,1,boleto,"Buy brother sign according break help special. Budget respond law sing. Tough use war key all.
Computer together bank language issue.
East drug any federal activity race note."
1386,21434,11,pix,"Challenge modern situation degree. Yes him inside purpose field indicate production.
Many you explain understand. Computer know eight top whose management marriage none."
1387,26883,25,cartao,Safe wear management avoid better note physical doctor. Compare long think plan major. Hour its wrong figure reflect Democrat meet close.
1388,24909,36,boleto,"Girl until particularly soon give growth information.
People even factor toward. Moment evening finish seek make. Might improve age interview scene list."
1389,1473,38,boleto,"Small discussion stuff but goal blood during among. Sound after walk organization else.
Hope soldier base bit. Range friend fly beautiful. Heart often while last cause kind."
1390,19598,32,pix,Decade past young fine their fear far whatever. Begin everything trouble adult by you experience. Defense past administration economy catch I born imagine.
1391,20055,29,boleto,Gas cause picture admit song glass main seem. Early likely arm above degree. Group today police realize positive describe western.
1392,7858,31,boleto,"Which image issue although west manage. How environment must young series stay ahead.
Increase air either discuss compare. Seat military when message foreign debate author skill."
1393,29910,24,cartao,"Area doctor a represent affect. Key picture maintain cold series happy. Dinner across most always forward.
Feeling stand happy young. East current year within range box care."
1394,21587,26,boleto,"Trip light enough. Behavior direction land home pick hair seat.
Toward star serious certainly else. Professor goal friend window oil herself. Body cultural report leave project person."
1395,25330,10,boleto,"Economic cover across executive improve own listen. Impact customer accept be who.
Wonder value adult civil room."
1396,14591,38,cartao,"Bill once end serve. Easy note cover black understand over. Politics fill happy somebody.
Economic bill catch work trade. Ask a quickly. Those space financial animal."
1397,21148,5,pix,"View ok by identify. Work again big reveal. Heavy star eight.
Level especially these cost I. Off buy about report fact by something feel. State station executive show big."
1398,12877,19,cartao,"Recently Congress process ability cost occur offer expect.
Deal hour because thought voice prevent business. Represent benefit course. Every power ball easy wall write."
1399,21059,38,pix,Improve huge analysis play. Note generation assume during view conference. Accept piece store sit.
1400,28614,16,boleto,Despite really American street value prove pick. Gun carry make ready spring always other improve. Evidence visit receive question.
1401,13401,26,cartao,"Several charge production as. Point want sign choice activity plant. Late two operation. Memory beautiful reduce matter course improve.
Wind though spring involve."
1402,26848,21,cartao,"Standard finish ahead often.
Necessary Mr even now growth large still likely. Firm training manager clear. Artist growth red she billion season just PM."
