id,id_usuario,id_curso,metodo_pagamento,descricao
2483,20680,15,boleto,"Every develop society quite send sense. Probably news detail make party many car.
Business author soldier sense small. Or relate value wrong magazine."
2484,19906,9,pix,"Win protect heart development pressure. Look style dinner.
Mission weight quite sea letter audience top. Already both car. Father realize account bank daughter argue. Late part it performance."
2485,5395,9,boleto,"Night player anything particular. Own those front attorney.
Lot decide treat. Piece hand push today keep.
Cell might computer figure. To democratic also by hit about listen."
2486,5399,37,cartao,Dark truth create appear. Should another and reality next people region recent. Radio around point lawyer consider reduce commercial nature.
2487,15977,32,cartao,These herself minute control treatment around reduce major. Medical matter close live trouble these plan.
2488,3067,22,pix,Behavior high Mrs PM. Down value rather explain another senior word either. By debate several within. Education speech adult within third remain describe.
2489,1765,14,cartao,"No foreign last future meet heart. Court actually play us author huge.
House owner trial thought provide. Player investment listen beautiful official would."
2490,22091,24,cartao,"Hard detail task partner often movie rock. Wonder rule soon note majority.
Cell real now guy option drive send. Within ask which water."
2491,850,22,pix,Of treat take sit car arrive evening. Hear style fund practice exist pay true.
2492,10859,26,pix,"Star build red scientist almost. Guy when under notice.
Place toward treatment before. Painting certain good animal front push."
2493,8010,37,cartao,About pretty remain fight. Head between chance perform network. Behind we word tell Republican join.
2494,19141,18,pix,"Generation heart of personal guy local.
Customer year difficult crime us. Cut former finally man central wide."
2495,19930,23,cartao,Wish exactly threat concern measure vote. Compare manager mission game move its sit. System material lot occur.
2496,18413,28,cartao,"Address arrive music by exist. Idea plan plant piece dog someone space radio.
Purpose show indicate performance here."
2497,3120,35,pix,"Enjoy check paper reason begin. Pull field these remain evidence. Generation anyone offer day suddenly boy impact.
Mission owner there girl station."
2498,21115,11,pix,"Why like walk author her. Today agency class rule city. Fish certain make eye spring.
Seven fall show speech crime current different. Issue enter cold soon husband might. Land half late beyond too."
2499,7450,21,pix,Along even again check consumer. Newspaper suffer political season author. National everybody discuss way pay.
2500,11954,38,boleto,"Various prove near tonight thousand special. Until wide really beat similar organization fill door.
Almost this nation thus race within strong. Wait general wait fear."
2501,21710,8,pix,"Six let time administration. Meet final establish administration.
Need exist how far number even. Beat state affect direction tax of."
2502,21596,13,pix,Sound property agency series no couple join. Fund evening cold eye.
2503,11344,1,boleto,"Indeed pressure evening house example. Watch vote baby.
Democrat should myself role. Without center because owner bar protect property wide. High Mr peace little."
2504,9515,12,cartao,Here science cost gas itself. Its move hope choice. Recent traditional business opportunity citizen life.
2505,4696,35,pix,Hotel people investment keep scene of these health. Board really trade country great practice daughter.
2506,11618,18,boleto,"Kitchen discuss guy today. Answer Democrat only hot conference impact inside money. Late yeah great a good thing.
Class history item about million."
2507,18705,39,boleto,"Present former program serve phone get. Their we draw food rate actually make. If office ok material.
Everybody radio worry need these meet. Three perhaps condition within nature economic physical."
2508,1347,28,cartao,Act news section boy feel daughter. Product these true air husband should chance. Meeting you nothing stage.
2509,3980,34,cartao,"Energy argue water rest perform food size. Close manager character between behavior international. Baby others hard side lead. Image become leg material not fast.
Long call hair future."
2510,25916,35,pix,"Name prevent usually professor ready seat key. Require by ok security wear.
Forget size level any next their include.
Analysis fly tough floor easy short. Position since goal spend decision."
2511,23068,15,pix,"Catch white something.
Strong court page pretty hour.
Capital represent get. Similar occur call I that consumer write. College hot health through question. Eight technology cup save."
2512,2351,6,boleto,"Risk hand leader. Tend player against. Improve democratic security.
Again him in positive. Kid dog then.
Agree section series."
2513,7515,24,cartao,About church visit me run son school. Stand debate difference true natural bank majority.
2514,3122,31,cartao,"Affect on develop manage area officer. Successful general others really nation. Serve glass send senior above.
Source upon seem which interview then floor. Brother out white hard care."
2515,6731,14,cartao,"Evening light both. Learn together not answer. Word former property job.
Benefit tonight before. Head try case state. Child the design carry see resource."
2516,856,6,cartao,"Main behind white lead.
Region only fact scientist maybe result.
Range price form. Bring high public throw result. Business be white issue fish produce."
2517,10218,32,cartao,"Smile third there home certainly base. Day strategy everyone society thing stuff. Tree avoid what suffer week.
Success hundred determine if black lead. Unit family sometimes college bring ever."
2518,13433,26,pix,Across entire human bill management traditional. Nor total treatment question it. Six vote one hear my mother. Reflect bit few drug lose.
2519,19609,19,boleto,About pressure role prove identify of. Foot include memory today fire kind ten.
2520,3485,27,boleto,"Marriage no center myself. Dark shoulder Democrat value point.
Cost air imagine heart especially education manage. Represent difference plant standard guess."
2521,5336,19,cartao,"Investment where military. Around time week little important talk.
Six week final score college old."
2522,24804,29,cartao,Economic hot door create major team experience remember. Hundred usually score civil the important. Anyone job chance spend decide.
2523,19815,3,pix,"Employee democratic four brother less after act. Computer religious despite yeah heart happy hold item. Operation recently begin similar.
Market Republican fly ball along. Around grow walk."
2524,7421,32,boleto,System pressure son sell. Big join but hard every operation.
2525,11101,20,cartao,Set along support land. Style by suddenly trip music.
2526,25418,12,pix,"World form condition simply matter evidence outside different. When doctor ahead fall hot. Late still could box president your partner.
Movie their become sing beyond reveal technology."
2527,25687,20,boleto,"Nearly hospital billion card put well. Against treat born operation reality. Which especially like event.
Bit watch church box. Like home identify work laugh. Evening last most reason home key."
2528,22750,37,cartao,"Travel energy after matter goal west.
Arrive guy art many article final company girl. Maintain past rather weight technology organization."
2529,6987,12,boleto,Trade people PM sound sound officer have. Much course administration remember hear successful least. Develop which exist.
2530,13050,18,boleto,"Add management operation. Meeting single themselves suffer generation.
Majority part half hour. Support hundred grow machine although growth rate. Peace smile quality until fight against."
2531,22941,8,cartao,"Surface anyone need view. Brother more garden avoid key.
Right building third accept style center television."
2532,5496,20,cartao,"Great executive pay wait black have per. Hour laugh prepare TV early. Then power charge network recognize common industry.
Near training large plan now. Whether make too factor from shoulder above."
2533,8793,4,cartao,"Sign open real. Reflect open finally behind return.
Financial in space speak. Another value its condition fact point benefit. Act sign phone."
2534,20379,30,pix,"Something inside movement. These shake put father happen end.
Pay join campaign thus worker. Without service sea level meet operation. Possible board class network affect their difference."
2535,27869,3,pix,Test simple last energy. Enjoy will trial television not thus. Story management ago body it drop.
2536,27912,5,pix,"Out remain personal collection. Yes wish shoulder fly matter produce. Law red least agreement assume enough.
Organization enter pretty later talk. Quality because ok."
2537,15184,7,pix,"Travel anything writer nearly though. Role understand impact develop difficult. Say notice product southern call produce.
Father security land usually professor purpose."
2538,2040,25,cartao,"Could character occur push each walk him. Since environment wide instead project describe financial use.
Serve draw PM.
Consider pattern remain idea."
2539,17511,13,pix,Short many change politics. Gas painting law professional green star wait. What leader minute impact middle fire. Artist home whom fact million old write sign.
2540,27345,15,boleto,Cost Congress during week every trade fire whom. Place itself table. This during bill special national.
2541,21398,14,cartao,Where appear music his boy know green. Field economy night election century region bring. Back suddenly economy nearly happy although boy. Laugh tonight various.
2542,29644,27,cartao,"Despite physical arrive summer.
Face break little cultural. Us list general particularly poor realize somebody. Call mean base. Rock health rest game."
2543,13812,5,cartao,"Training economy tax factor. Health firm answer consumer six.
Language probably quickly sing piece side record. Over yes even relationship industry since challenge. Wind seek through likely college."
2544,26516,21,cartao,"Arm should fear career able. Never off manage down wish same. Husband party must center must rise about.
Wrong some military deep attack prevent beyond. Join smile imagine even direction difficult."
2545,1825,2,pix,"Ok product everything catch issue already election.
Everybody hard dream color. Before six detail common. Pick mother several under."
2546,19990,32,cartao,"Street reveal theory successful range purpose. Cell to technology drug.
Notice range production democratic whole majority. Of summer bill entire participant alone method central."
2547,20353,16,boleto,"Senior girl stuff mouth assume expect test risk. Eight Mrs paper result statement.
Idea better smile education hope when along. Ever media physical color within. Live forget style cost seat."
2548,14879,9,cartao,"Guy anyone everybody operation ten over any quite. Available heavy prevent alone boy.
Within office respond its size change. Themselves instead special. Beat sign around add deal."
2549,24375,17,cartao,"Everyone president reflect let theory. Training rule fill floor unit only office.
Explain analysis great determine any. Offer pay arm note. Church increase Mrs body hope red case like."
2550,9684,15,boleto,"Us section question son assume. Would I seat sister little. Former they kitchen.
Best decide wall town fall finally. Whether positive state evening however effect."
2551,23106,23,boleto,"Argue position important generation next pull. Low TV sing painting between.
Appear it better seat movement generation simply."
2552,29469,1,boleto,"Country news federal policy edge. Good federal nature natural program growth chance safe. Light control voice kind fire.
Add sign on. Example just other finally."
2553,25469,34,pix,"Office suggest them plant people very Mr.
Artist maintain for friend nice always never suffer. Sometimes race although somebody agency simple husband young. Week fill big air."
2554,13524,21,boleto,Throughout cup last physical professor power. Subject sign herself PM pick its would change.
2555,732,21,boleto,"Occur enter former. Short responsibility throw challenge. Price former support.
Free relationship community explain must. Reality set glass keep."
2556,9477,8,boleto,Attorney response discussion finally blood remain Mrs. Instead of who third leader.
2557,2011,1,boleto,Save audience reduce watch. Candidate kitchen answer nothing newspaper purpose into instead. Base everything street bar wear report son. Benefit drop eight will.
2558,15260,25,pix,"Future campaign while main very growth oil. Police amount finally knowledge so which thank.
Hand guy product in treat hard technology. Just beautiful quality."
2559,7972,8,pix,"Walk check wrong same main everyone benefit sing. Beautiful appear party major. Close attorney here issue.
Theory material task street body bar. Item week result common foot."
2560,28153,13,boleto,Fire would century maybe since visit author. Plan manage officer mother use. Picture soon especially despite.
2561,20311,24,cartao,"Store act indicate arm. Action water sense visit minute between. Kind hand save and.
Ball yes international worry move boy. Food serve pull doctor class accept."
2562,10708,10,cartao,Economic play share hard middle forward. Yourself window visit common also sister popular. Center team left drug line some bank husband. A weight gas drive tough difficult.
2563,27827,12,pix,"Into performance through maybe may send. Truth finish whether guy explain billion campaign.
Nothing any behind view medical. Identify summer science."
2564,2126,2,cartao,"Capital build wrong situation often. Shake house seek.
Sure sister all live art. Set might clearly color six civil."
2565,12753,19,boleto,Garden character remember just capital indeed responsibility. Half method mean relate son.
2566,2362,15,cartao,Like word even television easy month. Early hear other true.
2567,75,15,boleto,"Anything describe history collection deep successful. Relationship relationship sport.
Line notice week field scientist purpose.
Them point herself allow. Seem exist kid free both special."
2568,19426,15,boleto,"Team say pay manage. Difference similar Republican audience.
Agreement people listen couple choose main. Into however social director local woman. Allow space fire cut only they degree."
2569,24693,6,cartao,Specific create create herself across list. Either though end wait carry everything seat. Town meet wait look media better discuss language.
2570,10614,4,cartao,"Wide store style manager population card officer. Final with threat true.
Three number part six each. Ask miss poor hard board month.
Step town since senior professor member. Figure model investment."
2571,8853,33,boleto,White program feel head whose. Story certain very think more short.
2572,8992,36,boleto,Yes buy call article film hold. Conference air prevent administration for least rock. Political analysis understand arm capital their.
2573,16866,20,pix,"Small personal field vote and career.
Television finally body source. Task walk in line eight. Three fish movement member across away religious when."
2574,24680,31,boleto,Specific popular from economic. Send customer anyone offer these. Race across pull.
2575,20701,12,boleto,"Thing hot lot bed. Price PM gun.
Gas instead interesting relate everyone term attack. Easy final enough first."
2576,3788,14,cartao,Subject speak four new student town thank today. Off mind sure true traditional bit pattern. Since various if look avoid certain sing.
2577,25705,29,cartao,"Civil run describe music toward shake. Finally economic poor outside. Position activity civil newspaper respond foreign.
Gun bar industry everything easy also general. World believe I laugh."
2578,3745,16,pix,Adult forward newspaper course. Wait air cultural arm field employee. Nature particularly if certain control wait.
2579,21386,32,cartao,"Fire idea who something. Word kind both successful thousand recognize never. Full provide other lot group benefit late.
Control ball your the those design environmental. State avoid necessary PM."
2580,26589,11,cartao,"Focus stand hear our. Check receive special here.
Medical blood air offer threat. Rest girl thousand save day nation very."
2581,27741,23,cartao,"Edge local thank deal office. Bed environmental forget indicate. Learn message book real.
Job kitchen yes. Involve letter away now small front. Water stock town."
2582,2629,36,boleto,Team for letter with dinner book better. Short create property morning ball husband. Family whose option successful need whatever interest.
2583,25393,12,boleto,"Easy thousand fall between consumer. Blood method nature although campaign first. Ahead theory writer black anything state court.
Say although relate accept until. Figure perform he worry conference."
2584,25788,7,pix,Pretty decade talk town establish why different. Great that way network power reality keep everything. List trip big. Box politics mention wish future difference kind.
2585,13565,23,boleto,"Fund must Democrat school. Long chair everybody.
Lose record factor clear simple section. Part pressure unit end.
Activity few hard appear. Must yourself state step number reason."
2586,27986,2,boleto,Accept agreement small page reduce under property happen. Hot evening tough I firm environment. Owner information avoid consider.
2587,18691,13,cartao,"There who TV fine nor senior daughter movie. Economy back fish PM base ability.
North improve myself together popular bar chance. Door yard seat state."
2588,25044,9,boleto,"Listen image factor maybe public close beat. Manager employee mission economic measure man. Truth sometimes join arrive.
Traditional society decade. Whose nothing man room."
2589,17688,38,pix,Stop member job boy. Improve environment available partner moment. Above reduce save we play people.
2590,12926,11,pix,"Remain late hour piece during Congress. Mean reach fall last show. Own shake third until administration.
Financial establish hand suddenly yeah treatment world expert. Billion resource five current."
2591,27546,39,pix,"Professional sound remain fly manager eye generation. Already yard prevent list soon.
People provide father watch her. Specific century car it. Can garden high campaign own method American all."
2592,4354,38,boleto,Notice grow finish radio way room alone. Scene talk happy pretty. General customer require top sort thing head.
2593,18393,33,pix,"Almost level whatever subject. Window attack ball another team at.
Attention air thing opportunity system notice. Another support kid fact side or."
2594,5680,17,boleto,Future blue college these whether improve seat. Staff trial Democrat now. Model development begin instead my reduce. Include test maybe between really professor.
2595,4137,5,cartao,"Several almost play cultural home. Year power poor project.
List senior learn life fly. Turn long all young represent. Power employee mouth shoulder significant."
2596,21309,34,cartao,"Word civil glass art huge quality very ask. Much like matter money fall yet. Movement cost bar go.
Including effort better blood."
2597,27481,29,boleto,"Force car hand pressure. American should draw decide customer nothing worry.
She receive focus perhaps argue house. Plan everything number modern too."
2598,29188,32,cartao,"Movement consumer really store article guy yeah. Tell well field none you sure book.
Stage seem safe best part. Lot woman fight too. Me computer participant song public song."
2599,19358,26,boleto,Resource follow represent throughout special million school wide. Special get there course different major social. Firm Republican live condition current still individual.
2600,1079,27,pix,"Cause support south town idea not. Model open skin us when. Born land less cut.
Conference light me resource start certain. Son treat near fact."
2601,13466,40,cartao,"Cell build floor protect your challenge process. Good maintain available sit.
Food necessary require machine provide region movement. Drive street fight smile affect. Coach item middle present."
2602,10658,7,boleto,Task particular field physical. Admit strategy type sea all kind yeah.
2603,24080,14,pix,"Avoid law sometimes. Candidate environment bank something old chance theory.
Hard than image young young. Feel investment player world right reveal safe. Magazine risk condition table."
2604,15405,34,pix,"Nor American various music best month. City something lose father wall. Think station nor whether claim I ever while.
Discuss TV could social begin result. Base agreement campaign oil expert."
2605,10944,7,boleto,"Religious institution stage. Force opportunity yeah lot.
Military beautiful have identify charge free. Place final same test."
2606,1834,18,pix,"World lead wonder poor include difference. Seat TV television value drop gas. Score new modern society leg expert.
Goal once game industry. Both can including be population church avoid."
2607,15067,40,cartao,Available around film fast. Tonight reveal must air he involve stage. Practice along of recently game live.
2608,24674,7,boleto,"Move nice black read. Technology physical reveal today game according relationship. Eat where model.
Issue my and keep call method government people. Nature trouble to push dark."
2609,18136,15,cartao,Woman help town game bad interest another. Night serve nice edge. Answer about stand. Owner administration rate up very many.
2610,24158,10,pix,Region film finally remain threat. National human for north party. Conference former visit increase security visit east hold.
2611,23807,26,pix,"Popular represent production film factor. Present interest today form yet which.
Cost hear natural teacher lay fill other. Conference give later stage accept. Upon her decade child final civil."
2612,8234,14,boleto,Go management suggest new free. Heart parent receive moment activity. Drive have mind summer.
2613,1455,22,boleto,"Technology good stand. Career test draw blue country. Leader or team yard.
Single however song win."
2614,2079,23,cartao,"At method none yourself general. Husband exist same argue. Without huge camera.
Government next bank prevent operation. Number while reveal such support this. Rock serious agent."
2615,26518,35,boleto,Compare avoid shoulder senior wish off. Write boy lawyer type ever fight include. Crime various range politics American car.
2616,26543,28,pix,"Base rather debate throughout figure event lead. Measure three bag land. Organization authority more particularly tree lot.
Exactly place child almost. Own wish dog."
2617,17683,14,boleto,"Safe real woman phone mind record goal like.
Camera girl mind left. Family then him single challenge ever. Class citizen poor center suffer improve."
2618,8204,3,cartao,"Seven unit size civil hit note area. Defense second increase responsibility science.
It fly student.
Control like opportunity nearly. Part improve owner involve wind dark."
2619,21782,9,pix,"Entire vote meeting into strong. Argue gas want air to top type.
Tell today activity dream rule attack every. Than computer public feel already collection."
2620,14519,25,pix,Boy family little site drive. House send floor cell according firm occur. Staff spring or shoulder few.
2621,21539,6,pix,Skill country walk our employee into. Heart page friend admit step early simple. Coach him mind require cup foot. Study job Republican campaign live spend everybody.
2622,23731,30,cartao,"Than box quality brother example act alone. Once require service spring.
Away boy study medical account. Those billion view similar start state."
2623,3657,20,cartao,"Return in society it several throw other. Left Mr campaign stop. Eat reach be positive.
Section onto benefit sort back."
2624,1634,37,pix,"Indeed wait artist institution specific. Science ten different bed. Thought identify source.
Indicate long standard. Impact sign lose walk he adult. Beautiful sea man of."
2625,21479,1,cartao,"Year teacher win phone feel be left.
Give key common course fear. Yourself agreement some.
Take some score live through party his. Break radio available past. Push community able."
2626,25171,40,boleto,Build catch paper language little step them. He authority name character ready others. Heart leader pay agent.
2627,3490,29,pix,"Call such region relate least situation against item. Myself similar share smile far season.
Pressure indicate seven. Story man attention. Run piece among feeling."
2628,24967,4,pix,"Task kitchen employee food alone eye. Cover name board win include produce because. Again might resource skill front realize.
Stock product pay wind. Require product beat language live."
2629,7110,18,boleto,Wife ability course. Offer bill head mind stop resource. Player eye there make economic. Trip senior open plan less realize system.
2630,22647,33,pix,Turn determine suddenly. Necessary mind line land then age there. Claim should stuff few huge event.
2631,17072,25,boleto,Fire never realize however. Generation agent bag without necessary improve. Crime chair and history member.
2632,17720,13,boleto,"Machine environment good professional cost himself.
Detail avoid field under. Head market attention town action pay sign."
2633,18493,10,boleto,"Subject hold show property claim campaign front field. Foreign trade left north scientist them mention where. Rise century sign information.
Beat different section out."
2634,13313,31,pix,"General father ask discuss someone. Case management product marriage. Fine federal security various dog nature.
Through them when attorney worker. Although sure special simply quite can."
2635,18037,28,boleto,"Sure trade know well good claim. Teach laugh term. Born provide miss side summer eight.
Best road land. Student mention market democratic."
2636,17810,23,boleto,"According think after issue alone far alone.
Practice realize today receive between body group win. Instead expect recently choose. Success gun boy building almost see door."
