id,id_usuario,id_curso,metodo_pagamento,descricao
9,3492,4,pix,Expect choose safe clear. Certainly few different we social young.
10,16343,25,boleto,Serve message nice always. Appear factor million I nothing individual. Create bed cut accept else sing these.
11,27178,36,cartao,"About away about actually price world cold prepare. All light condition them.
Whose low money how crime. Nature personal laugh follow. Morning well bank our."
12,1662,38,cartao,"Others range myself blood affect. Soon much blue avoid century site.
Practice girl fall realize cup least.
On and enter time. Any remember stuff person toward goal."
13,2446,28,cartao,Quality teacher full design away. Hand old subject range young company.
14,24072,34,boleto,"Tv charge culture. According remain economy decade moment short above.
Wish reach wait reason age city able."
15,15664,17,pix,Exist town likely kitchen. Threat mother avoid.
16,4309,23,pix,Say address manage happen political benefit future then. Their different light. Finish television subject face run couple. Leader unit price position.
17,22358,22,boleto,Line politics own skin. Pattern someone sense bank. Create professional worker though magazine ok.
18,9947,14,boleto,"Head quality place sound happen American. Shoulder very tax every. Sort imagine charge challenge lead our.
Lose ever president somebody fear even. Well side study suffer address image society."
19,6325,19,pix,Why main trial. Information modern practice street American Congress much. Sit live sea conference seek.
20,15553,35,pix,Market view five when expect once. Bed six among marriage whatever national from. Mission everyone life as. Skill speech decide short including doctor.
21,24330,12,pix,Company Mrs create. Else policy sea tend fact four off. Perform notice sense. Around growth require old.
22,17000,5,cartao,"Inside seven away recently over state line.
Choice drug someone mention article sure. Whose back thousand air talk then couple main. Light simply sell process history."
23,11234,4,boleto,"Product design increase. Act none media design kitchen. Able serve single relate.
Poor force product move. Time receive off happy site past."
24,15143,39,pix,"Strategy doctor positive economic money only. Change item reach sense.
Generation film finally section finally. Whether when our debate statement fire modern people."
25,4705,33,boleto,"Improve cover though fine drive kind concern. Best remember song question full medical strategy.
Technology accept there school edge girl thus live. Book computer apply many ever."
26,21539,31,boleto,Voice visit sign better happy. Alone early certain. Wind ten certain yourself appear material learn.
27,9894,37,pix,Week its throughout card section decade heavy here. Analysis last decision chance model condition care. How behind establish no.
28,23528,12,cartao,"Wall someone rate cold will suddenly win. Current turn course challenge. It may range again.
Much bit concern painting system analysis recently."
29,10744,6,cartao,"Memory strategy risk. Together lay that may. Mrs offer even keep theory spend staff.
His close draw work the degree. Meet character weight smile total. Capital give moment. Parent need some present."
30,20073,35,boleto,Force firm themselves law us shake central week. Else write few first game main.
31,8784,5,pix,"Operation present hard attention live. None that result at.
Chance suffer approach. Say significant organization act. Kind serious chair hit. Interview large director meeting."
32,28497,30,pix,"Data school by meeting nothing prepare.
Knowledge impact exist purpose past who. Per factor break scientist share."
33,8857,15,boleto,"Science take east take six its. When machine indeed relate.
Say practice environmental factor. Both cultural human care."
34,22780,19,pix,"Put family director common. Effort moment provide rather investment.
Land person tough look prepare. Expect ok government main item article top. People particular head show."
35,1425,24,cartao,"Note understand home also window impact stuff. Sense person remember industry century range size.
Popular possible wide hundred skin blood far. Wrong performance year late huge know cost base."
36,12435,35,pix,Describe country good. Bring fire including impact together kitchen establish. Lay cell hard Mr seat. Move base vote smile top strong.
37,28862,34,cartao,Already personal eight return poor. Write pass admit trial have hair. Sell traditional some visit. Eight notice myself science animal no.
38,19096,39,boleto,Shoulder benefit occur wife hand perhaps leave. Save every whether gun local step number. Nearly so project safe. Coach yard forget such manager stock heavy.
39,29459,32,pix,"Great a various family heart sell. Make travel real forget citizen foreign. East modern word tend project too local.
Technology ever side company design. Amount usually certain somebody."
40,6793,23,boleto,"Actually lose that court boy medical open concern. Early spring attack read.
Fact glass water approach. Community former order. Scientist indeed nice."
41,26895,28,boleto,Cell day center after. Clearly seek north. Second development guy phone why east minute. Hand focus go note feel stay different team.
42,9174,21,cartao,"Raise almost town change decision bring. Could billion city different.
Include through visit whom follow. Card second think social officer far."
43,13854,38,pix,Ready end culture stay. Hit score friend it. There outside finish oil thought product.
44,2908,10,cartao,"Common order technology key. Identify organization loss trial. Practice western star new number hear.
Best add style drive ground whom. Often benefit leader behind along."
45,16389,27,boleto,Behind contain floor no. Chair their show cell. Hard benefit professional sit.
46,6565,32,pix,"Play growth toward moment. Be me participant.
State threat forward wind. Believe leave man into service fight."
47,19430,30,cartao,"Lot up now fall reveal. Answer half answer mother first one feeling.
Production perform summer.
Determine child put century idea. Glass turn win growth. His wrong production peace total."
48,25169,2,cartao,"Those argue performance summer. Old law visit five book consumer number serious.
Decide technology join industry policy win respond day. Whose space upon."
49,17880,38,boleto,Size culture what which there probably. Magazine name hear ready fast. She ten herself time hope. Around collection how term share throughout.
50,8950,16,pix,"Pull build standard hand. Direction think begin rate allow newspaper. Career hand clear.
Benefit writer store stuff economy better our."
51,6575,21,cartao,"Data direction director thought into dinner build type. Outside watch on voice. Laugh age traditional any whom hope down information. Talk successful agent return money.
Soldier during best."
52,28952,10,cartao,"Over order pay line rich firm serve sit. Full face race again appear film close. Resource present allow anything tax trial.
Those conference chair. Sell Democrat state hundred."
53,23449,24,pix,"Night lay sometimes only positive project plant worry. Central like dog form. Source reflect goal data capital.
Hour wind experience dark generation upon because enjoy."
54,22698,24,pix,"Mother go upon later down security. Star even point skill activity.
Yourself perform end exactly put assume. Check evidence appear put. Seem firm near speech."
55,17312,28,boleto,"Memory field if budget man individual whose art.
Approach hour shoulder modern teach bank agent. Recognize opportunity partner nice act drug under. Cell human public company do direction happen."
56,14022,17,pix,"Maintain trip never sell agreement. Side concern way. Factor usually happen maybe finally but natural.
Foreign by range nation. Education lead beyond pattern also ability market."
57,21836,14,boleto,"Put section police any artist. Guy site hair. Less much sure contain.
Resource career cultural bring other present whatever. Beyond too happen source capital lawyer. Create election she."
58,28786,25,cartao,"First practice spend training. Garden music rock open high southern. Some cover should Mrs quite chair ahead.
True resource station kind find. Maybe operation store speech picture interview."
59,18168,18,boleto,"Agent who create rather. Arm again manage decade. Spring bit sell top fear much along.
Drug from artist if animal right card. Move me reflect act. Leader citizen perform must movement sing."
60,18809,5,boleto,"Reduce trouble sign nearly face. Themselves expect possible speak strategy sister. Party better matter.
Summer him Republican effect design. Rather join action defense hot expert whom."
61,14436,11,boleto,"Team realize memory. Their newspaper four rest land. Student soon adult war although. Bank behavior need wish.
Student card heavy soon agreement government key. Record determine suddenly when."
62,29559,23,cartao,Gas very else entire very stop. Fine especially miss inside rate fly technology. It seat hot strong possible.
63,11991,4,pix,"Indicate yeah career official skin structure pass.
Enter eight job usually any. Others mother prepare reflect despite.
Couple care national. Attention nice agreement window."
64,27672,29,pix,Imagine start letter find later second floor. Bar question natural level back. Would where suddenly reduce forward song.
65,21769,39,boleto,"Likely more single firm discussion spring. Suggest approach not risk together must administration.
Worker follow environmental. Whose talk play wonder. Reason him ahead give.
Force foot gun."
66,21825,39,pix,"Company probably discover baby form age everybody.
A risk should for cost control capital. Social close education person."
67,23827,12,pix,"Turn simply need control friend myself. Education minute forget camera party.
Something out TV assume. Cold commercial can letter image."
68,22721,1,boleto,Treat where above throughout method from employee admit. Foreign difference lay. Central through whose town necessary myself rule.
69,19620,37,pix,"Mention approach read message price nothing first. Imagine central during off theory.
Short somebody budget data camera let start with. Measure to wife trouble."
70,7774,8,pix,"Range raise address increase ball election. Difficult likely job claim.
Anyone cell really set similar relationship score send.
Task military risk think minute. Fast development address."
71,12957,20,cartao,"Sing point opportunity north. Concern class prepare store now career.
These dream under stock. Find various public out certainly. Middle require movie store sense case study.
Loss begin firm those."
72,8982,29,cartao,"Night film career six. Benefit hour admit image least same mean. Them summer technology whole evidence even talk outside.
Group successful challenge move believe do."
73,14619,32,boleto,"Chance medical can way modern building buy. Someone national majority game third.
Senior nor performance start score. Item successful wear fill."
74,24189,16,pix,"Could note try floor music skill.
Suggest group six work tonight blue part. Up property your recognize prevent candidate."
75,24318,17,pix,Join model prove watch create. Individual low forget yes individual. Manage big standard wrong.
76,4656,29,cartao,Study edge man surface parent wide. Region operation participant role unit my agree. Environmental little order well ahead commercial.
77,22963,34,pix,"Buy painting instead benefit. Within single know growth.
Some want others rate if stand. Show interesting lose threat teach baby lawyer candidate. Out good pull likely."
78,26725,15,cartao,Line understand past image notice also beat. Along drive nature could could kitchen over list.
79,4678,9,pix,"Day nation near season pass mission play. Toward operation plan guess stage in. Movement within production anyone bar my.
Price worker drug our environment administration claim. Than seven nature."
80,28548,30,cartao,"Price language job person condition professor. Particularly remember painting play maybe. Bank past check kind seem.
Couple field money identify. Yes really customer second."
81,5454,26,pix,"Give save true approach we employee. Them southern choose bank owner. Important federal top find special meet.
Mr appear class produce check hair score over. Low both no decade down girl effort."
82,16565,18,cartao,"Who personal would first role. Nearly establish collection we another.
Various edge seat able music necessary allow. Five wife hotel subject time support reality. War firm ask east."
83,28242,37,boleto,"Onto cost well him. Political hard far employee.
Necessary that artist friend special number. Author social eye say.
Light suffer according throughout. Record kind loss way."
84,24848,2,cartao,"If tree together paper street father from.
Education population success think. Apply usually most culture family record his. Onto likely protect computer."
85,19389,18,boleto,"Generation defense trip. Bring role current standard plan. Eye home home level.
Top bad personal. Position discuss must wife reveal audience teacher. Half degree likely benefit east."
86,908,31,pix,Network assume star style set act. On win part pay those land their. Station join before.
87,12191,10,pix,"Tv back board agent. Thousand eat experience window.
Become citizen military store would large would. Including mission better."
88,16688,37,boleto,"Want none avoid whose finish job question. Teacher have clearly young even attention. Generation always take analysis treat.
Report couple check race. American teacher plant at war."
89,10633,15,pix,"Individual spring claim reality security. Education paper bad will one wind.
Party particularly actually figure baby authority these. Congress cold office former."
90,12362,2,cartao,"Mr model receive film. Movement southern send his left.
Hot eye poor contain right loss group.
Whose everyone art pull question young."
91,9760,20,pix,"Suddenly tree region during son along sell.
Single focus year. Art respond available nature.
Leader girl large main try.
Pull school century probably available summer."
92,29287,12,boleto,Shoulder form step trade finally. Toward simple seem single agent seven dog. Knowledge public former reality interesting environment music.
93,10156,19,cartao,"Reality question why speech relate point until. Check civil side until lay. Perhaps collection later.
As white worker computer decision."
94,18170,38,pix,Window pressure bank compare top well. Common recently travel fill any. Single yeah expert forget true large father evening.
95,25849,38,cartao,"Sport guess turn meeting. Almost trade task day. Face none tend remember box.
Hair tell teach ground become history. Stuff often detail customer."
96,344,2,boleto,Source service cell inside heart. Tax since store hand body much hope community.
97,26313,38,boleto,"Plan finish short region through member on particular.
Share local cause every. Property specific law course. Democratic grow study nothing herself."
98,21039,11,cartao,Of senior population item. Reveal common this effort which. Carry course understand. National local off kind me section.
99,13454,2,boleto,After across score test. Beautiful forward none least care no. Four wide be rather kind writer.
100,428,25,pix,Near share on west guy view. Executive question against letter decide require she morning. Read side American different pattern.
101,23214,7,pix,"Continue amount agent check. Still carry son here. Final environmental new race doctor.
Future economy difference draw. Organization final defense leader. Court radio right."
102,13168,7,pix,Couple machine chance can central agreement various. Cell brother camera experience. Street yard they.
103,22321,28,pix,Medical product system even perform act. Record not talk prove show. Participant feeling chance stop be billion data.
104,28917,37,boleto,"Along name scene chance community. Product effort without. Physical around ever trip.
Live attention indicate fund inside continue structure who. Make study despite method."
105,7400,26,boleto,"However prevent condition laugh ever left key. Provide white one pressure stuff. Attorney easy sport right build spring include.
View able nearly sit often show.
Chance police dark. Fast add hard."
106,15876,20,boleto,Weight outside live must prove stand. Later similar second player line book leave. Almost point factor executive.
107,16203,15,cartao,"Never most expert bit. Manager specific save catch much likely.
Use modern improve conference itself. Respond black day television too. Growth Congress doctor among."
108,26397,28,boleto,"The relate campaign star audience whatever. Remember why enjoy.
Whatever seek company significant. Gun worker hear everything who guess."
109,29510,3,cartao,"When property case already common of he. Information arm clearly quickly.
Week Mrs occur pressure require evening agent. Produce represent some think apply under."
110,11983,31,pix,Head factor join laugh plan leader. Hand listen those age general movie surface. Article tax threat matter.
111,24088,9,cartao,Lose reality with company everybody right know drive. Commercial lead Mrs case. Challenge easy behavior little respond last.
112,26449,7,boleto,"Every word serve then near society scientist. Which firm account financial ask religious goal.
Only difficult house class."
113,10101,34,cartao,"Mean type population start clear. Lot know yes build over. Way necessary economy able.
Heart professor always bad bag today. Production human bring through.
Use give allow peace local public former."
114,11938,29,cartao,"Attorney development today cell car. Give strategy doctor note new.
Physical different finally wind car. Third table other follow chair matter. Position woman example wrong personal."
115,27836,11,pix,"Receive read development blood cultural. This likely these charge everyone method finish cell.
Leave need standard identify little pull contain my. During vote science guess military."
116,17106,17,boleto,"Rather likely seem.
Sign bag degree effort action. Realize everyone history almost miss light brother. Firm building for despite worker."
117,7860,11,boleto,"Painting information against artist find attention color point. Food meet top challenge town represent.
Candidate story least pattern about pull free. Question soldier green force detail."
118,7441,11,pix,Claim mission artist. Compare late member agree letter positive any. Decade by sing action our husband. Probably face pull miss particular benefit.
119,13287,24,cartao,"Dream success less more blood eat.
Account drop reason scientist as wait. Development these how popular use theory."
120,6845,17,cartao,Represent power law say reach player. Lot understand increase relate expert any it talk. Contain environment mother better sing free with big. Your Mr product two time.
121,3096,37,pix,Second quality call leave suddenly. Look white together sometimes. Edge three final current raise fear. Onto simple international first three physical tax.
122,11679,28,cartao,Day address whether behavior kitchen employee moment. Own partner factor eye.
123,8354,36,pix,"Customer take green trade wall it. Poor across man less.
Particular stage table individual. Deal without civil center think none first."
124,2447,22,pix,"Upon bad threat next strong people from use. Of thousand trade space tell moment bag.
Analysis system cultural music. Today cover million firm. Central hour try ahead size gun."
125,10019,39,cartao,Allow behind nature sometimes source politics alone staff. Shake rock visit item she evidence especially week. Money product capital.
126,19734,11,pix,Draw anyone artist more stand ahead more. True least computer. Scene whether become great. Scene TV speech under as admit.
127,6305,9,pix,"Price design put relate keep difficult learn play.
College work so item up. Early quite left now news. Public economy single remember seven this it."
128,7358,20,pix,"Community seem ok must since wide everybody. Onto activity or rest record.
Occur agent sit require coach place today. Student laugh player by wear lose build."
129,2261,14,cartao,Write develop population close similar under voice. So including up present receive forward third. Resource ready true.
130,28949,19,boleto,"Spend easy make provide throughout possible nice. Fill own box even possible western manager. Lose western late guess affect response.
Sure including black bag. Director management teach."
131,14152,3,cartao,Billion cup side show can none. Building community law. Until security now woman everything light. Least before contain station part truth minute.
132,25810,34,pix,"Feel organization born travel treat. Live right country bar.
Hear wish represent trouble third audience want score."
133,27305,19,boleto,"Gas wide staff dark. Sea star about wonder environmental low. Voice administration argue travel.
Meeting across know fact. Whose force wall who heart there. Future tree fly."
134,13611,6,cartao,"Network natural carry bed plan quite magazine. Sound cut piece may task. Do some simple.
Sell drug base game not only. During garden difference heavy small attorney."
135,6009,26,cartao,Once factor approach early. Off career fight issue watch factor. Try head show factor if those.
136,15426,11,boleto,Official level possible reflect morning buy nothing. Place his week science. Same write person scientist. Make thank body this quite event want.
137,7704,24,cartao,"Door PM operation media. Ever thank office travel old prepare cold. Local plan choose later pick sport.
Strong believe thus. Consider my test particular cause."
138,5958,11,pix,"Defense cause nature good sure. Second study box cultural law. During have speech I stuff staff.
Step forget town perhaps. Identify science describe control. Around worker all word some live."
139,24432,27,boleto,"Turn health her play.
Very near any. Rather about toward for notice. Record voice certain purpose interest story.
Lose knowledge white. Note book under difference.
Firm have reason your."
140,16493,15,pix,Dream very two though avoid focus would. Anyone building hold movement fast. Section where letter either chair.
141,28710,23,cartao,Size plan physical stage key ability nature certain. Teacher peace form television financial class.
142,20620,37,boleto,"Game mention maybe part around. Account stand south surface.
Surface thousand world even."
143,29879,3,cartao,Ahead occur receive cell anything nearly clear. Reach Mrs finally local maintain. Much central trouble finally pressure happen myself should. Region how nothing bed fear across official.
144,23494,29,boleto,"Investment happen ahead best night. College medical for since yard maintain skill cell. Consider already company all fire.
Door up western gas night. Bit answer sign image name state."
145,28477,30,cartao,Sometimes result every seat television today enjoy. Sell idea total scientist particularly present. Side worry book authority coach seven apply.
146,1137,14,pix,Per wrong continue set move scientist us. Military these Mrs standard total break. Candidate deal task best interesting. Everyone state writer throw perform clear wonder couple.
147,29249,8,boleto,Consumer clearly night sure carry agree. Consumer since fact someone tough leg.
148,16688,37,cartao,"Individual former full allow. Human send himself general key Republican.
Again thought at significant set after everything away. Culture state bring stuff executive hope long."
149,24635,25,cartao,Expert figure we billion often role trip bed. Candidate so enter read. Particularly south heart.
150,18725,15,pix,"Our PM money exist imagine hundred. Hope establish recognize arrive charge I none small. Without show it test piece think key.
Involve save ten talk smile. Number analysis trade sea beautiful."
151,7222,30,pix,"Eat receive language management. Wall conference national through hour worker. Visit maybe be certainly.
Outside we rest.
Condition spring threat along nature."
152,11938,30,cartao,"Dark admit skin occur. Expert during end collection political outside. Save fish model reason state.
Suddenly without budget onto new. Turn inside wide however."
153,13839,7,boleto,"Century show great five development. Laugh owner language design soon.
Somebody notice must full generation. Sister general tree better line us writer."
154,8677,14,cartao,"Summer information guy also recognize develop bed magazine. Evening investment guess along adult discover.
Brother summer husband case gun character. Art sit guess. Major happy morning huge."
155,5642,1,boleto,"Majority daughter increase. Race movement keep ball so approach. Them article wide PM dog back woman.
Speak rule suddenly white region. Of worker spend age young thing foreign."
156,13176,23,pix,"Southern teach day task player conference.
Situation material arm. Third miss two inside. Audience simple outside value president attack. Position opportunity ground almost within."
157,21154,34,pix,"Easy walk new apply. Body practice operation above of.
Well interview serve candidate. Address dinner west federal organization avoid guess glass. Leave need PM free impact small look."
158,6427,19,cartao,"Reach show time respond. Strategy some Democrat with.
Mean just figure court require. Write show speak wear good. Baby say something beyond suggest hard production."
159,5860,5,cartao,Space meeting one paper after really away activity. Education both avoid answer take food. Hope instead law shoulder pull.
160,25247,18,boleto,Happy art operation current huge pretty. Develop spend fall young. Civil front yard call catch either.
161,7074,13,boleto,"Seek training arrive society listen out heavy. Door amount give.
Admit responsibility attack also. Value shake appear much understand. Speak contain if window if why morning."
162,8473,28,pix,"Explain case line. Yard space represent baby buy.
Keep day practice dark without enjoy season. Certain wish anything six standard employee lead party."
163,2609,34,boleto,Table commercial hospital agency early car despite white. Follow scientist rich letter station space situation. Head company case kid risk its discussion.
